2020-02-10,2020-02-11,2020-02-12,2020-02-13,2020-02-14,2020-02-16,2020-02-17,2020-02-18,2020-02-19,2020-02-20,2020-02-21,2020-02-23,2020-02-24,2020-02-25,2020-02-26,2020-02-27,2020-02-28,2020-03-01,2020-03-02,2020-03-03,2020-03-04,2020-03-05,2020-03-06,2020-03-08,2020-03-09,2020-03-10,2020-03-11,2020-03-12,2020-03-13,2020-03-15
Wok Fried Ginger Scallion Pork ,Coffee Glazed Pork Ribs,Sweet & Sour Pork ,Szechuang Gong Bao Pork Slice ,Jiang Zheng Spare Ribs ,Plum Sauce Pork Ribs ,Wok Fried Black Pepper Pork ,Pig Trotters in Black Vinegar ,Braised Pork Belly w Mei Chye ,Sweet & Sour Pork w Lychee,Szechuan Hui Guo Rou ,Curry Pork,Wok Fried Ginger Scallion Pork ,Coffee Glazed Pork Ribs,Sweet & Sour Pork ,Szechuang Gong Bao Pork Slice ,Jiang Zheng Spare Ribs ,Plum Sauce Pork Ribs ,Yu Xiang Rou Si ,Wok Fried Black Pepper Pork,Coffee Pork Ribs,Sweet & Sour Pork ,Stewed Pig Trotters w Peanuts ,Claypot Style Dry Bak Ku Teh w Shredded Cuttlefish,Hainanese Pork Chop ,Fermented Beancurd Pork Belly,Jiang Zheng Spare Ribs,Sweet & Sour Pork ,Sweet & Sour Pork ,Char Siew Sauced Pork Ribs
Chicken Rendang,La Zi Ji,Thai Green Curry Chicken,Malaysia Style Creamy Butter Chicken ,Baked Cajun Chicken ,Honey Baked Chicken,Hong Zao Chicken ,Sweet & Sour Chicken w Pineapples ,Soya Sesame Oil Chicken ,Tangerine Glazed Honey Chicken ,Drunken Herbal Chicken w Black Fungus ,Nanyang Style Curry Chicken ,Chicken Rendang,La Zi Ji,Thai Green Curry Chicken,Malaysia Style Creamy Butter Chicken ,Baked Cajun Chicken ,Honey Baked Chicken,Rosemary Chicken w Baby Potatoes ,Prawn Paste Chicken ,Taiwanese 3 Cup Chicken ,Satay Chicken Goreng ,Braised Miso Chicken,Wok Fried Mongolian Chicken ,Salted Egg Yolk Chicken ,Coffee Glazed Chicken ,Oyster Sauce Chicken w Shiitake ,Plum Sauce Chicken ,Authentic Butter Chicken ,Herbal Chicken w Wolfberries 
Baked Pesto Fish ,Assam Curry Fish w Seasonal Greens,Gan Xiang Clams ,Teochew Style Steamed Fish ,Crispy Fish in Crab Chilli Sauce,Taiwanese Salt & Pepper Prawns ,Malaysia Style Creamy Butter Fish ,Baked Laksa Fish ,White Pepper Clams,Hk Style Steamed Fish ,Hk  Style Typhoon Prawns ,Taiwanese Salt & Pepper Fish ,Baked Pesto Fish ,Assam Curry Fish w Seasonal Greens,Gan Xiang Clams ,Teochew Style Steamed Fish ,Crispy Fish in Crab Chilli Sauce,Taiwanese Salt & Pepper Prawns ,Wok Fried Black Pepper Clams,Buttery Cereal Fish ,Sweet & Sour Fish w Nata De Coco,Cantonese Style Steamed Fish ,Fried Fish w/ Plum Sauce,Sotong w/ Spicy Tomato Sauce,Szechuan Gong Bao Fish ,Chilli Crab Clams,Typhoon Shelter Fish ,Baked Lemon Butter Fish ,Buttery Salted Egg Yolk Fish ,Cereal Fish 
Fish Nuggets,Jia Xiang Dou Fu ,Thai Style Seafood Tofu w Roasted Peanuts ,Stewed Black Bean Sauce Potatoes w Minced Pork ,Cai Poh Tofu ,Ma La Xiang Guo ,Otah Otah ,Black Bean Sauce Stewed Potatoes w Minced Pork ,Fish Fingers ,Hong Shao Seafood Tofu ,Sweet & Sour Fries w Chicken Frank ,Potato Au Gratin ,Fish Nuggets,Jia Xiang Dou Fu ,Thai Style Seafood Tofu w Roasted Peanuts ,Stewed Black Bean Sauce Potatoes w Minced Pork ,Cai Poh Tofu ,Ma La Xiang Guo ,Crispy Nhoh Hiang Balls,Sweet & Sour Potatoes with Chicken Frank ,Hashbrown ,Hong Shao Seafood Tofu ,Thai Style Beancurd ,Cai Poh Egg ,Ngo Hiang Crabmeat Roll ,Stewed Black Bean Sauce Potatoes w Minced Pork ,Otah Spring Roll ,Seafood Tofu in Wolfberry Egg White Sauce ,Thai Style Beancurd ,Gado Gado 
Ma Po Seafood Tofu ,Cai Poh Omelette ,Steamed Egg w Crabstick ,Hk Style Curry Fish Balls ,Shrimp Silky Omelette ,Teriyaki Cuttlefish Balls ,Braised Eggs ,Tomato Scrambled Eggs ,Yong Tau Foo in Laksa Gravy ,Kimchi Gyoza ,Sambal Egg ,Sambal Fish Balls ,Ma Po Seafood Tofu ,Cai Poh Omelette ,Steamed Egg w Crabstick ,Hk Style Curry Fish Balls ,Shrimp Silky Omelette ,Teriyaki Cuttlefish Balls ,Tomato Egg ,Braised Eggs ,Foo Yong Omelette ,Stewed Potatoes & Minced Meat (black bean sauce) ,Seafood Wanton,5 Spice Wu Xiang ,Steamed Teochew Fish Cake,Cai Poh Tofu ,Seafood Cheese Beancurd,Seafood Gyoza ,Ma La Xiang Guo,Otah Fish Cake
Vegetarian Spring Roll ,Braised Chicken Feet ,Yakitori Chicken Skewers ,Baked Drumlet ,Otah Otah ,Tomato Egg ,Baked Beans w Luncheon Meat,Seafood Wanton ,Seafood Beancurd Roll in Chilli Crab Sauce + Man Tou ,Mozzarella Cheese Stick ,Seaweed Chicken ,Silken Tofu w Crabstick ,Vegetarian Spring Roll ,Braised Chicken Feet ,Yakitori Chicken Skewers ,Baked Drumlet ,Otah Otah ,Tomato Egg ,Kimchi Gyoza ,Vegetarian Spring Roll ,Yam Ngoh Hiang,Sambal Egg ,Ampang Yong Tau Foo ,Homemade Rojak ,Omelette w Shrimps ,Teriyaki Takoyaki Balls ,Steamed Egg w/ Crab Meat & Mushroom,Steamed Egg with Crabstick ,Braised Egg ,Hong Shao Tofu 
Tomato Chicken Soup,Watercress Soup ,Fish Ball Soup ,BKT Meatball Soup ,Cream of Chicken Soup ,Miso Soup,BKT Soup w Pork Balls ,ABC Soup ,Yong Tau Foo Soup ,Wintermelon Soup ,Herbal Chicken Soup,Egg Drop Seaweed Soup ,Tomato Chicken Soup,Watercress Soup ,Fish Ball Soup ,BKT Meatball Soup ,Cream of Chicken Soup ,Miso Soup,ABC Soup,Salted Veg Tofu Soup ,Egg Drop Seaweed Soup ,Wintermelon Soup ,Cream of Chicken Soup,BKT Soup w Pork Balls ,Tomato Chicken Soup ,Lotus Root Peanut Soup ,Watercress Soup ,Kimchi Tofu Soup ,Miso Soup,BKT Soup w Pork Balls 
"Carbnonara, Shredded Ham & Garlic Bread","Nasi Briyani, Authentic Butter Chicken, Dal-Cha & Prawn Crackers ","Tonkotsu Udon w (Beancurd Skin, Katsudon)",Homemade Bak Ku Teh Set ,"Pesto Fusilli, Cajun Chicken Drumstick & Caesar Salad ",Japanese Katsudon,Ipoh Style Shredded Chicken White Curry Noodles ,"Local Style Chicken Rice ( Steamed Hainanese Chicken, Char Siew, Braised Tau Kwa & Egg)",Vietnamese Pho ,"Mac N Cheese, Cajun Chicken Chop & Garden Green Salad ","Ma La Xiang Guo ( Ma La Noodles, Golden Man Tou & Ma La Mixed Ingredients ",Fish & Chips (served w Roasted Summer Vegetables & Cheese Fries),"Carbnonara, Shredded Ham & Garlic Bread","Nasi Briyani, Authentic Butter Chicken, Dal-Cha & Prawn Crackers ","Tonkotsu Udon w (Beancurd Skin, Katsudon)",Homemade Bak Ku Teh Set ,"Pesto Fusilli, Cajun Chicken Drumstick & Caesar Salad ",Japanese Katsudon,Tempura Ebi Soiyu Udon ,"Ma La Xiang Guo ( Ma La Noodles, Golden Man Tou & Ma La Mixed Ingredients)","Pesto Fish, Roasted Summer Vegetables & Fries ","Wanton Noodles (homemade char siew, dumplings, chicken feet & chye sim)","Mac N Cheese, Cajun Chicken Chop & Garden Green Salad ","Local Style Chicken Rice ( Steamed Hainanese Chicken, Char Siew, Braised Tau Kwa & Egg)",Japanese Katsudon ,"Olive Pilaf Rice, Fish w Mushroom Cream Sauce + Sweet Potato Fries ",Homemade Seafood Ban Mian,HK Style ChickenCurry Baked Rice with Garden Green Salad ,"Shoyu Udon w (Beancurd Skin, Ebi Fry)","Hainanese Cutlet Chicken Rice ( Fried Chicken, Braised pork, nonya chap chye & Curry Graby)"
Grass Jelly & Longan ,Apple,Chilled Honey Sea Coconut w Pineapples ,Green Bean Soup,Banana,AppLe,Barley with Beancurd Skin,Apple,Red Bean Soup,Chilled Honey Sea Coconut w Pineapples,Banana,Apple,Grass Jelly & Longan ,Apple,Chilled Honey Sea Coconut w Pineapples ,Green Bean Soup,Banana,AppLe,Chilled Almond Jelly with Longan ,Banana,Green Bean Soup,Grass Jelly with Longan,Apple,Apple,Grass Jelly & Longan ,Apple,Green Bean Soup w Sweet Potatoes ,Bo Bo Cha Cha ,Pear,Banana